{
 "name": "Sample Commentary",
 "type": "commentary-pack",
 "formatVersion": 1,
 "entryCount": 3,
 "parts": [
  {
   "file": "000-gen.json",
   "range": {
    "start": {
     "book": "Genesis",
     "book_index": 0
    },
    "end": {
     "book": "Genesis",
     "book_index": 0
    }
   },
   "entryCount": 2,
   "bytes": 375,
   "sha256": "1a375b617cfc2ed22637ff5d6c6bd23b658ca2750137828054eb3799947a1922"
  },
  {
   "file": "042-jhn.json",
   "range": {
    "start": {
     "book": "John",
     "book_index": 42,
     "chapter": 1
    },
    "end": {
     "book": "John",
     "book_index": 42,
     "chapter": 1
    }
   },
   "entryCount": 1,
   "bytes": 214,
   "sha256": "7753a7b9e63d3e75c300c9541f3b740ee1d4b9d4972aa9b5623ee6fe7a4a5d66"
  }
 ]
}
